{
  "event_id": "evt-0001",
  "event_version": "v1",
  "event_type": "deployment.requested",
  "occurred_at": "2026-09-19T10:00:00Z",
  "tenant_id": "tenant-acme",
  "correlation_id": "corr-0003",
  "idempotency_key": "idem-deploy-0001",
  "actor": {
    "type": "service",
    "id": "control-center"
  },
  "source": "omes",
  "data": {
    "job_id": "job-0001",
    "operation": "backup",
    "target": {
      "server_id": "srv-0001"
    }
  }
}
